author,body,created_utc,id,link_id,parent_id,permalink,score,subreddit
Quatroking,"&gt;* YeeLight  
&gt;  reverse engineered protocol, so I am hesitant to trust we won't be blocked in the future

huh? Yeelight provides the protocol spec on their own website: https://www.yeelight.com/download/Yeelight_Inter-Operation_Spec.pdf

I've been using six of them for over a year now, they're pretty solid.",1603296044,g9jvvlp,t3_jfcenw,t3_jfcenw,/r/homeautomation/comments/jfcenw/rgbct_bulbs_are_a_mess_what_do_you_use/g9jvvlp/,1,homeautomation
kaizendojo,"No, but I have no pets and it's just me so the clean base seemed like overkill for me.  In your case it might make sense but you can always buy it separately later on if you see the use case.  I usually go about four missions or so before emptying the on board and cleaning the filter.  I bought a Eufy hand vac to get the corners or for quick clean ups and between the two my floors are spotless.

I'm hoping to try out the roomba floor mop (Braava) at some point; I like how the i3 and the Braava work together.  I'm hesitant to trust both tasks to one bot though.  They're two very different tasks and it's hard for me to believe one robot can be designed to do both well.",1603205738,g9fs0nn,t3_jep8um,t1_g9fqpkt,/r/homeautomation/comments/jep8um/eufy_died_need_something_to_replace_it/g9fs0nn/,1,homeautomation
olderaccount,"Don't trust your life and safety to an open-loop automation circuit that requires a lot of different parts to work properly to keep you safe.  

Either modify the machine itself to have a closed-loop safety circuit or get a new machine.",1603110254,g9bf839,t3_jdz0wl,t3_jdz0wl,/r/homeautomation/comments/jdz0wl/power_socket_that_turns_off_after_power_has_been/g9bf839/,1,homeautomation
babecafe,"Useful, but the reality is wiring to breakers is done long before the switch/outlet covers are put on. Switches and outlets could be installed before or after drywall - mine were done after drywall. Covers are put on after painting the wall, and is otherwise a fairly mindless task: just match the number of gangs and screw them in place all around the house.

So, is the worker installing the covers going to consult someone's circuit map and put on labels that no one else can see without undoing the work? A homeowner or subsequent worker shouldn't trust such labels.

I had my electrician label breaker panels as they pulled the rough wiring. Even then, it wasn't perfect, but it's more accurate than when the electrician gets reminded the local inspector will check for breaker panel labels just before final inspection.

If I had reason to remove a cover once, I might label it in case I had to do it again. But I'd still check the correct breaker has been turned off.",1603070751,g9a4zp6,t3_jds2gg,t3_jds2gg,/r/smarthome/comments/jds2gg/life_hacks_label_backs_of_switchoutlet_covers/g9a4zp6/,4,smarthome
